{"$schema":"https://json-schema.org/draft/2020-12/schema","$id":"https://ai-sdlc.dev/schema/operator/store/dispatch-claim.schema.json","title":"Immutable dispatch claim","type":"object","required":["claim_id","operation_id","operation_generation","semantic_effect_key","external_dispatch_key","created_at","trusted_context_digest"],"properties":{"claim_id":{"type":"string"},"operation_id":{"type":"string"},"operation_generation":{"type":"integer","minimum":0},"semantic_effect_key":{"type":"string","pattern":"^[0-9a-f]{64}$"},"external_dispatch_key":{"type":"string","pattern":"^dispatch-[0-9a-f]{40}$"},"created_at":{"type":"string"},"trusted_context_digest":{"type":"string"}},"additionalProperties":false}
