{"claim_id":"dc-c171e76a64d633c6bfcc52483d52266cd8e5b581","created_at":"2026-10-02T14:51:09Z","external_dispatch_key":"dispatch-7113c3be28b369b05e6b0d69919ab768a668a8b5","operation_generation":0,"operation_id":"op-44cfc3ff9577493f5cfe2d9e8bdece3e0d42111d","semantic_effect_key":"2d83bf84c8ad7df7eb78e5f44d75b8c744e534ddfcd96a5fb46286bd536f6347","trusted_context_digest":"7f1d186057796e9fbebe53d073e0a19a05904a36fdc851c2bf677ecf4270affd"}
