{"claim_id":"dc-078cc81975549f5b598c99f5d4fde001ec2e1bf4","created_at":"2026-09-27T10:37:44Z","external_dispatch_key":"dispatch-5f5ad0ae9bd9570a21c20b0f9880ce97af35147f","operation_generation":0,"operation_id":"op-345c3c1fb5ebcf1e9306d744b49985e3a6bfaa0e","semantic_effect_key":"a2b8127966309d19e190d4415844d4ae41509d3432fb61dc72a4d779228bb514","trusted_context_digest":"9c71e8e93c134954ad26718b161364bf74160272c574638019e002d71e297881"}
