{"claim_id":"dc-44100fdf26b6028d24a39ba66482cbefcfcb5e61","created_at":"2026-10-03T01:19:55Z","external_dispatch_key":"dispatch-d774674fa60b1708668a28ff73c43fe4334eebe1","operation_generation":0,"operation_id":"op-3f7aa9b6290c8d1d90868dc079ce1af30cbaa7f4","semantic_effect_key":"80b31137a408f2b0ee85248bd069b972af80b9777f91f2bd00c9b27b42f9e804","trusted_context_digest":"3d5095e119b05e2b8787b78ae3a6b10446ded90cc973db9afab6044e68e018e2"}
