{"claim_id":"dc-edd07ea8cd3abf1adc76a16d800bb5774787773f","created_at":"2026-09-26T14:22:32Z","external_dispatch_key":"dispatch-973cedbffa7723ce4fa1971e105934b66598de77","operation_generation":1,"operation_id":"op-c58fa9be2c4a123ea61fd5ba863feee289cf84fb","semantic_effect_key":"552588cc1997593853df0035680f633f060de12230981c9eb03bc246f4e2991d","trusted_context_digest":"426f8a83f656f20703a5821899193c2fda20b177d519b4bd7293e79ab8e5f9b1"}
