{"claim_id":"dc-b6a4ddd91606cbc987090d901e18948a4c07f1ec","created_at":"2026-10-02T07:19:45Z","external_dispatch_key":"dispatch-b08d96d277029ed88bf13163d06ed1382d33ef8d","operation_generation":0,"operation_id":"op-5d48298138da23ae8959accdbf9199b62a3183b0","semantic_effect_key":"9cb3dc7f487071cb831dd4862000fe11633c148760b3a64173f428ad6a2a4a6d","trusted_context_digest":"071c84b6582034115b1d6280809dec62da4b52ba1598f4d2b32b047e860d33b0"}
