{"claim_id":"dc-5d16db068b3289e0edb4734ccf8295e7226e5ae7","created_at":"2026-10-02T10:19:39Z","external_dispatch_key":"dispatch-928c86d2dd1b2b2ee062a7c097a7788676168bd4","operation_generation":0,"operation_id":"op-b57ae7501638ecf18d53131b0a1681c476788085","semantic_effect_key":"2f531c645cc7f9de04f93625653f3e7d1c49fc8b9f41912dd9d97bb488ce5d22","trusted_context_digest":"484d9401e1fa0c03ea86dd43cef319ffc2082c4ebf829b7da2dae840d3d21fa1"}
