{"claim_id":"dc-0a0127700bffdee902442e5257887ef37cf99f21","created_at":"2026-10-02T11:47:10Z","external_dispatch_key":"dispatch-4131a15ceb87ff3705604aa0d89d7ae3de79baff","operation_generation":0,"operation_id":"op-414804d1c42c8ffed0581210f9a8f737d818c719","semantic_effect_key":"b25599cdd95b3f5702b31751ec059677d46463f980a8925e6e8190a434f31be2","trusted_context_digest":"6181d45ecfb699e41749968199ad6667ad1b82a9b18786efad5bf8a36bca99d3"}
