{"claim_id":"dc-d2d3ba9332cab53a707a3d090ea4920def79f911","created_at":"2026-09-26T03:30:00Z","external_dispatch_key":"dispatch-d96d3cb82eaf214d347509b687fe8bd81b86fe3f","operation_generation":1,"operation_id":"op-3a6b6a776b24e9a277247782816a27f1b2c12694","semantic_effect_key":"80c908650f728899b937206d4230adb4fda0de072ffc9e1d5aa78a09fdcf292d","trusted_context_digest":"9e480a4d8bae518cab9a6251fce83cec40c9d5f9d2d034250ee7862616ec3071"}
