{"claim_id":"dc-278fc800a1985f49e6b215eb2dca9a7f8589a173","created_at":"2026-09-26T08:20:48Z","external_dispatch_key":"dispatch-8264e85dd3e481c8d73a02b957b2174c783fe48c","operation_generation":1,"operation_id":"op-fce9ab431886f46b81f5ac6bb4148741df5e2c33","semantic_effect_key":"729a6456fb3099db157d09e899fe6c604464ba10253c833bd2b65a3c9528b5db","trusted_context_digest":"623a7cbe72c8539d15ba7986140b70bbcf9eead37b2d771e8c393d611810b915"}
