{"claim_id":"dc-d884c43bc73fbdc8faa1b824f91d735e03ca6f05","created_at":"2026-09-28T15:41:40Z","external_dispatch_key":"dispatch-751ddb97b6a6d1950b7ad0fc73a826184eb4da78","operation_generation":0,"operation_id":"op-486399a9269119d7a72959a524e6c4d4fdc54dcb","semantic_effect_key":"ed7ca1cf1283498db792fb011aefb82adba1fa6acdd9982a72cc8bd8e79da21f","trusted_context_digest":"8f903a10926432abe28c8e4b667a3a3e9d6c9d872419967108750ec346414107"}
