{"claim_id":"dc-98e07917a43b546a368ae9e8f8445be781c69b70","created_at":"2026-10-02T12:50:46Z","external_dispatch_key":"dispatch-2aa4d45a7293a3730276ef1f74f954e4e2eea3ab","operation_generation":0,"operation_id":"op-855d16d6867ed00bcbd462e7d37cd3dfeb896aa1","semantic_effect_key":"9fb59a3832e92b1de40a38f1ef52dcb6996f0227e05ecbef2c1422e96628d63a","trusted_context_digest":"537470734327386bc130e70bd92be917827c18e4a310a7a3e8c9e38ea9057634"}
