{"claim_id":"dc-759d504ff3bd66e97c155e4b9dfb249359702741","created_at":"2026-10-02T07:22:32Z","external_dispatch_key":"dispatch-b08d96d277029ed88bf13163d06ed1382d33ef8d","operation_generation":1,"operation_id":"op-5d48298138da23ae8959accdbf9199b62a3183b0","semantic_effect_key":"9cb3dc7f487071cb831dd4862000fe11633c148760b3a64173f428ad6a2a4a6d","trusted_context_digest":"f0f0615cfa3510d55214b8e05baac43e072423bf9db49c161d2b00a4bb3d7861"}
