{"claim_id":"dc-67407721f7b64b6415087117642ff245917ec494","created_at":"2026-09-25T01:55:16Z","external_dispatch_key":"dispatch-019708556a0acd072fea70b562b6214d3c3831c8","operation_generation":1,"operation_id":"op-a571465e14f372c9a275591ffdfd36d618bb33dc","semantic_effect_key":"56b8975751710f816ab15a545054e1a7512f205d7a8f64c6a73e228381995420","trusted_context_digest":"0b6ef22c16b529f8f361ca14862e310d784e8ec21b96f5a404e38134e26c768f"}
