{"claim_id":"dc-157b9bed796ace7b9fc3ec433835ebd5d567972d","created_at":"2026-09-27T15:28:26Z","external_dispatch_key":"dispatch-1df8b7af94f9b79fb4209be0006b66d1ba72a092","operation_generation":0,"operation_id":"op-adbd8ac5f8568892ed9b8a7d103020d15e6f2cca","semantic_effect_key":"963c2164effeed83b55c5763f625b78e409cb78722f419284ed6594db900718c","trusted_context_digest":"5b41aae0216cc20ffb7fe73f0fcceda00efe16ae381d56e6013b0e4a2391e75e"}
