{"claim_id":"dc-fb1287c0b608d772a80b928d873dff1492e80913","created_at":"2026-09-27T11:14:23Z","external_dispatch_key":"dispatch-47848d29d76458f8d74b668ba7cc93a7ff15ca88","operation_generation":0,"operation_id":"op-6d8b2c7ada6a7ef8f3f30d52ac7840fbb75361ec","semantic_effect_key":"3174d92b15ec1e1d42c3cf9cf918fbe15e1c202b7cdaf52ac4b9913dfc3988e1","trusted_context_digest":"2332b5c09de44efef08fd80c260548ab45435c1a6c03d5f51726d01c7eb403e3"}
