{"claim_id":"dc-92a57faea972edbba7bb3d97bb88676f3eca5451","created_at":"2026-09-27T10:09:44Z","external_dispatch_key":"dispatch-b41620733fb1a9fd607f8a5069be75ae1dc759e5","operation_generation":1,"operation_id":"op-78379a19401b6cfbca1fdee05f2ab01ac33b1b9c","semantic_effect_key":"a9ca55daa5f1f626547d6745412cbe462db09d0ad8a69939340f217c90313523","trusted_context_digest":"9c7afa311d34b918a4c0fb589471426089bb255b620c4c78cba0c444834ed906"}
